{
  "$schema": "http://json-schema.org/draft-07/schema#",
  "$id": "https://aicoding.local/schemas/kit-manifest.schema.json",
  "title": "AiCoding Kit Manifest",
  "type": "object",
  "required": [
    "schemaVersion",
    "id",
    "name",
    "version",
    "kind",
    "mode",
    "commands"
  ],
  "additionalProperties": false,
  "properties": {
    "schemaVersion": { "type": "integer", "enum": [2] },
    "id": {
      "oneOf": [
        { "type": "string", "pattern": "^[a-z0-9][a-z0-9-]*[a-z0-9]$" },
        { "const": "{{.ID}}" }
      ]
    },
    "name": { "type": "string", "minLength": 1 },
    "version": { "type": "string", "minLength": 1 },
    "kind": { "type": "array", "minItems": 1, "items": { "type": "string", "minLength": 1 } },
    "mode": { "type": "string", "enum": ["go-builtin", "external-cli", "powershell-specialty", "declarative"] },
    "description": { "type": "string" },
    "source": { "$ref": "#/definitions/source" },
    "paths": {
      "$comment": "Path roles are Kit-defined registry keys; values remain strict strings.",
      "type": "object",
      "additionalProperties": { "type": "string" }
    },
    "commands": {
      "$comment": "Command names are Kit-defined registry keys; every command body uses the closed command schema below.",
      "type": "object",
      "minProperties": 1,
      "additionalProperties": {
        "type": "object",
        "required": ["type"],
        "additionalProperties": false,
        "properties": {
          "type": { "type": "string", "enum": ["builtin-check", "builtin-lifecycle", "builtin-package", "external-command", "go-composed", "specialty-pwsh", "unsupported"] },
          "path": { "type": "string", "minLength": 1 },
          "args": { "type": "array", "items": { "type": "string" } },
          "extraArgs": { "type": "array", "items": { "type": "string" } },
          "supportsJson": { "type": "boolean" },
          "supportsDryRun": { "type": "boolean" },
          "executable": { "type": "string", "minLength": 1 },
          "steps": { "type": "array", "minItems": 1, "items": { "type": "string", "minLength": 1 } },
          "requiredPaths": { "type": "array", "items": { "type": "string", "minLength": 1 } },
          "include": { "type": "array", "items": { "type": "string", "minLength": 1 } },
          "exclude": { "type": "array", "items": { "type": "string" } },
          "outputName": { "type": "string", "minLength": 1 },
          "reason": { "type": "string", "minLength": 1 }
        }
      }
    },
    "skills": {
      "type": "object",
      "additionalProperties": false,
      "properties": {
        "umbrella": { "$ref": "#/definitions/skill" },
        "members": { "type": "array", "items": { "$ref": "#/definitions/skill" } }
      }
    },
    "hooks": {
      "$comment": "Hook payloads are owned by the selected Kit mode and remain an intentional extension point validated by the Kit consumer.",
      "type": "object",
      "additionalProperties": true
    },
    "commonDependencies": {
      "type": "array",
      "items": { "$ref": "#/definitions/commonDependency" }
    },
    "export": {
      "$comment": "Export declarations vary by Kit asset class and remain an intentional consumer-validated extension point.",
      "type": "object",
      "additionalProperties": true
    },
    "state": {
      "$comment": "Lifecycle state declarations vary by Kit mode and remain an intentional consumer-validated extension point.",
      "type": "object",
      "additionalProperties": true
    },
    "trust": {
      "$comment": "Trust metadata is intentionally extensible across Kit kinds and is additionally validated by Kit governance.",
      "type": "object",
      "additionalProperties": true
    },
    "profiles": {
      "$comment": "Profile names and per-profile budgets are Kit-defined and are validated by the Kit lifecycle consumer.",
      "type": "object",
      "additionalProperties": true
    }
  },
  "definitions": {
    "source": {
      "type": "object",
      "additionalProperties": false,
      "properties": {
        "kind": { "type": "string", "enum": ["git", "content"] },
        "url": { "type": "string", "minLength": 1 },
        "commit": { "type": "string", "pattern": "^[0-9a-fA-F]{40}$" },
        "digest": { "type": "string", "pattern": "^sha256:[0-9a-f]{64}$" }
      },
      "oneOf": [
        {
          "properties": { "kind": { "const": "git" } },
          "required": ["kind", "url", "commit"],
          "not": { "required": ["digest"] }
        },
        {
          "properties": { "kind": { "const": "content" } },
          "required": ["kind", "digest"],
          "not": {
            "anyOf": [
              { "required": ["url"] },
              { "required": ["commit"] }
            ]
          }
        }
      ]
    },
    "skill": {
      "type": "object",
      "required": ["id", "path", "role"],
      "additionalProperties": false,
      "properties": {
        "id": { "type": "string", "minLength": 1 },
        "path": { "type": "string", "minLength": 1 },
        "role": { "type": "string", "minLength": 1 },
        "description": { "type": "string" },
        "tags": { "type": "array", "items": { "type": "string" } }
      }
    },
    "commonDependency": {
      "$comment": "Common dependency adapters may carry capability-specific metadata while id and path stay mandatory.",
      "type": "object",
      "required": ["id", "path"],
      "additionalProperties": true,
      "properties": {
        "id": { "type": "string", "minLength": 1 },
        "path": { "type": "string", "minLength": 1 },
        "version": { "type": "string" },
        "usage": { "type": "string" }
      }
    }
  }
}
